{
  "_id": "672022a2b4d5e8f1a2c3d4e5",
  "dma": {
    "name": "CHICAGO, IL",
    "normalized": "chicago-il"
  },
  "counties": [
    {
      "name": "COOK",
      "normalized": "cook",
      "zipCodes": [
        "60601",
        "60602",
        "60603",
        "60604",
        "60605",
        "60606",
        "60607",
        "60608",
        "60609",
        "60610"
      ]
    },
    {
      "name": "DUPAGE",
      "normalized": "dupage",
      "zipCodes": [
        "60101",
        "60103",
        "60105",
        "60106",
        "60108",
        "60126",
        "60137",
        "60138",
        "60139",
        "60148"
      ]
    },
    {
      "name": "KANE",
      "normalized": "kane",
      "zipCodes": [
        "60109",
        "60119",
        "60120",
        "60123",
        "60124",
        "60134",
        "60140",
        "60142",
        "60144",
        "60147"
      ]
    },
    {
      "name": "KENDALL",
      "normalized": "kendall",
      "zipCodes": [
        "60447",
        "60450",
        "60502",
        "60503",
        "60505",
        "60538",
        "60560"
      ]
    },
    {
      "name": "LAKE",
      "normalized": "lake",
      "zipCodes": [
        "60030",
        "60031",
        "60035",
        "60040",
        "60041",
        "60044",
        "60045",
        "60046",
        "60047",
        "60048"
      ]
    },
    {
      "name": "MCHENRY",
      "normalized": "mchenry",
      "zipCodes": [
        "60012",
        "60013",
        "60014",
        "60033",
        "60034",
        "60050",
        "60051",
        "60071",
        "60072",
        "60097"
      ]
    },
    {
      "name": "WILL",
      "normalized": "will",
      "zipCodes": [
        "60403",
        "60404",
        "60408",
        "60410",
        "60416",
        "60421",
        "60431",
        "60432",
        "60433",
        "60435"
      ]
    }
  ],
  "allZipCodes": [
    "60012",
    "60013",
    "60014",
    "60030",
    "60031",
    "60033",
    "60034",
    "60035",
    "60040",
    "60041",
    "60044",
    "60045",
    "60046",
    "60047",
    "60048",
    "60050",
    "60051",
    "60071",
    "60072",
    "60097",
    "60101",
    "60103",
    "60105",
    "60106",
    "60108",
    "60109",
    "60119",
    "60120",
    "60123",
    "60124",
    "60126",
    "60134",
    "60137",
    "60138",
    "60139",
    "60140",
    "60142",
    "60144",
    "60147",
    "60148",
    "60403",
    "60404",
    "60408",
    "60410",
    "60416",
    "60421",
    "60431",
    "60432",
    "60433",
    "60435",
    "60447",
    "60450",
    "60502",
    "60503",
    "60505",
    "60538",
    "60560",
    "60601",
    "60602",
    "60603",
    "60604",
    "60605",
    "60606",
    "60607",
    "60608",
    "60609",
    "60610"
  ],
  "metadata": {
    "totalCounties": 7,
    "totalZipCodes": 67,
    "createdAt": "2025-10-28T22:23:21.836Z",
    "updatedAt": "2025-10-28T22:23:21.836Z"
  }
}

